{"benchmark": {"command": "bash .autoresearch/autoresearch.sh", "duration_seconds": 0.549, "exit_code": 0, "tail_output": "METRIC capability_pass_rate=1\nMETRIC default_cli_seconds=0.507\n", "timed_out": false}, "checks": {"command": "bash .autoresearch/autoresearch.checks.sh", "duration_seconds": 0.495, "exit_code": 0, "tail_output": "...................                                                      [100%]\n19 passed in 0.19s\n", "timed_out": false}, "confidence": null, "direction": "higher", "heartbeat": [{"detail": "", "name": "session_files", "status": "ok"}, {"detail": "", "name": "memory", "status": "ok"}, {"detail": "0/25", "name": "budget", "status": "ok"}, {"detail": "Dirty files outside autoresearch scope: .agents/rules/01-core.md, .agents/rules/06-memory.md, .agents/rules/_index.md, .gitignore, AGENTS.md, SKILL.md, config/default.yaml, conftest.py", "name": "git_scope", "status": "warn"}, {"detail": "", "name": "secret_scan", "status": "ok"}], "lesson": "Accepted measured result for capability_pass_rate: 1.0", "metric": 1.0, "metric_name": "capability_pass_rate", "metrics": {"capability_pass_rate": 1.0, "default_cli_seconds": 0.507}, "objective": "Improve RPA Harness reliability with measured, reversible changes.", "run": 1, "status": "keep", "timestamp": "2026-04-28T20:20:15.553436+00:00", "type": "run"}
{"benchmark": {"command": "bash .autoresearch/autoresearch.sh", "duration_seconds": 0.472, "exit_code": 0, "tail_output": "METRIC autoresearch_test_passes=31\nMETRIC default_cli_seconds=0.435\n", "timed_out": false}, "checks": {"command": "bash .autoresearch/autoresearch.checks.sh", "duration_seconds": 0.438, "exit_code": 0, "tail_output": "...............................                                          [100%]\n31 passed in 0.20s\n", "timed_out": false}, "confidence": null, "direction": "higher", "heartbeat": [{"detail": "", "name": "session_files", "status": "ok"}, {"detail": "Memory unavailable: <urlopen error [Errno 61] Connection refused>", "name": "memory", "status": "warn"}, {"detail": "1/25", "name": "budget", "status": "ok"}, {"detail": "", "name": "git_scope", "status": "ok"}, {"detail": "", "name": "secret_scan", "status": "ok"}], "lesson": "Accepted measured result for autoresearch_test_passes: 31.0", "metric": 31.0, "metric_name": "autoresearch_test_passes", "metrics": {"autoresearch_test_passes": 31.0, "default_cli_seconds": 0.435}, "objective": "Improve RPA Harness reliability with measured, reversible changes.", "run": 2, "status": "keep", "timestamp": "2026-04-29T07:34:45.682993+00:00", "type": "run"}
{"benchmark": {"command": "bash .autoresearch/autoresearch.sh", "duration_seconds": 0.441, "exit_code": 0, "tail_output": "METRIC autoresearch_test_passes=32\nMETRIC default_cli_seconds=0.408\n", "timed_out": false}, "checks": {"command": "bash .autoresearch/autoresearch.checks.sh", "duration_seconds": 0.417, "exit_code": 0, "tail_output": "................................                                         [100%]\n32 passed in 0.19s\n", "timed_out": false}, "confidence": null, "direction": "higher", "heartbeat": [{"detail": "", "name": "session_files", "status": "ok"}, {"detail": "Memory unavailable: <urlopen error [Errno 61] Connection refused>", "name": "memory", "status": "warn"}, {"detail": "2/25", "name": "budget", "status": "ok"}, {"detail": "", "name": "git_scope", "status": "ok"}, {"detail": "", "name": "secret_scan", "status": "ok"}], "lesson": "Accepted measured result for autoresearch_test_passes: 32.0", "metric": 32.0, "metric_name": "autoresearch_test_passes", "metrics": {"autoresearch_test_passes": 32.0, "default_cli_seconds": 0.408}, "objective": "Improve RPA Harness reliability with measured, reversible changes.", "run": 3, "status": "keep", "timestamp": "2026-04-29T07:36:08.199313+00:00", "type": "run"}
{"benchmark": {"command": "bash .autoresearch/autoresearch.sh", "duration_seconds": 0.7, "exit_code": 0, "tail_output": "METRIC memory_search_alias_compatibility=1\nMETRIC default_cli_seconds=0.459\n", "timed_out": false}, "checks": {"command": "bash .autoresearch/autoresearch.checks.sh", "duration_seconds": 0.432, "exit_code": 0, "tail_output": ".................................                                        [100%]\n33 passed in 0.21s\n", "timed_out": false}, "confidence": null, "direction": "higher", "heartbeat": [{"detail": "", "name": "session_files", "status": "ok"}, {"detail": "", "name": "memory", "status": "ok"}, {"detail": "3/25", "name": "budget", "status": "ok"}, {"detail": "Dirty files outside autoresearch scope: harness/memory/server.py", "name": "git_scope", "status": "warn"}, {"detail": "", "name": "secret_scan", "status": "ok"}], "lesson": "Accepted measured result for memory_search_alias_compatibility: 1.0", "metric": 1.0, "metric_name": "memory_search_alias_compatibility", "metrics": {"default_cli_seconds": 0.459, "memory_search_alias_compatibility": 1.0}, "objective": "Improve RPA Harness reliability with measured, reversible changes.", "run": 4, "status": "keep", "timestamp": "2026-04-29T07:39:41.642703+00:00", "type": "run"}
{"benchmark": {"command": "bash .autoresearch/autoresearch.sh", "duration_seconds": 0.598, "exit_code": 0, "tail_output": "METRIC failure_report_score=14\nMETRIC default_cli_seconds=0.484\n", "timed_out": false}, "checks": {"command": "bash .autoresearch/autoresearch.checks.sh", "duration_seconds": 0.471, "exit_code": 0, "tail_output": "....................................                                     [100%]\n36 passed in 0.22s\n", "timed_out": false}, "confidence": null, "direction": "higher", "heartbeat": [{"detail": "", "name": "session_files", "status": "ok"}, {"detail": "", "name": "memory", "status": "ok"}, {"detail": "4/25", "name": "budget", "status": "ok"}, {"detail": "", "name": "git_scope", "status": "ok"}, {"detail": "", "name": "secret_scan", "status": "ok"}], "lesson": "Accepted measured result for failure_report_score: 14.0", "metric": 14.0, "metric_name": "failure_report_score", "metrics": {"default_cli_seconds": 0.484, "failure_report_score": 14.0}, "objective": "Improve RPA Harness reliability with measured, reversible changes.", "run": 5, "status": "keep", "timestamp": "2026-04-29T07:46:28.857918+00:00", "type": "run"}
{"benchmark": {"command": "bash .autoresearch/autoresearch.sh", "duration_seconds": 0.591, "exit_code": 0, "tail_output": "METRIC memory_retrieval_score=1\nMETRIC default_cli_seconds=0.477\n", "timed_out": false}, "checks": {"command": "bash .autoresearch/autoresearch.checks.sh", "duration_seconds": 0.452, "exit_code": 0, "tail_output": ".....................................                                    [100%]\n37 passed in 0.22s\n", "timed_out": false}, "confidence": null, "direction": "higher", "heartbeat": [{"detail": "", "name": "session_files", "status": "ok"}, {"detail": "", "name": "memory", "status": "ok"}, {"detail": "5/25", "name": "budget", "status": "ok"}, {"detail": "", "name": "git_scope", "status": "ok"}, {"detail": "", "name": "secret_scan", "status": "ok"}], "lesson": "Accepted measured result for memory_retrieval_score: 1.0", "metric": 1.0, "metric_name": "memory_retrieval_score", "metrics": {"default_cli_seconds": 0.477, "memory_retrieval_score": 1.0}, "objective": "Improve RPA Harness reliability with measured, reversible changes.", "run": 6, "status": "keep", "timestamp": "2026-04-29T07:49:15.657753+00:00", "type": "run"}
{"benchmark": {"command": "bash .autoresearch/autoresearch.sh", "duration_seconds": 0.791, "exit_code": 0, "tail_output": "METRIC yaml_runner_api_action_lines=26\nMETRIC default_cli_seconds=0.727\n", "timed_out": false}, "checks": {"command": "bash .autoresearch/autoresearch.checks.sh", "duration_seconds": 0.693, "exit_code": 0, "tail_output": "...........................................                              [100%]\n43 passed in 0.35s\n", "timed_out": false}, "confidence": null, "direction": "lower", "heartbeat": [{"detail": "", "name": "session_files", "status": "ok"}, {"detail": "", "name": "memory", "status": "ok"}, {"detail": "6/25", "name": "budget", "status": "ok"}, {"detail": "", "name": "git_scope", "status": "ok"}, {"detail": "", "name": "secret_scan", "status": "ok"}], "lesson": "Accepted measured result for yaml_runner_api_action_lines: 26.0", "metric": 26.0, "metric_name": "yaml_runner_api_action_lines", "metrics": {"default_cli_seconds": 0.727, "yaml_runner_api_action_lines": 26.0}, "objective": "Improve RPA Harness reliability with measured, reversible changes.", "run": 7, "status": "keep", "timestamp": "2026-04-29T07:51:23.192072+00:00", "type": "run"}
{"benchmark": {"command": "bash .autoresearch/autoresearch.sh", "duration_seconds": 0.648, "exit_code": 0, "tail_output": "METRIC agent_plan_safety_score=1.0\nMETRIC default_cli_seconds=0.542\n", "timed_out": false}, "checks": {"command": "bash .autoresearch/autoresearch.checks.sh", "duration_seconds": 0.563, "exit_code": 0, "tail_output": ".............................................                            [100%]\n45 passed in 0.31s\n", "timed_out": false}, "confidence": null, "direction": "higher", "heartbeat": [{"detail": "", "name": "session_files", "status": "ok"}, {"detail": "", "name": "memory", "status": "ok"}, {"detail": "7/25", "name": "budget", "status": "ok"}, {"detail": "", "name": "git_scope", "status": "ok"}, {"detail": "", "name": "secret_scan", "status": "ok"}], "lesson": "Accepted measured result for agent_plan_safety_score: 1.0", "metric": 1.0, "metric_name": "agent_plan_safety_score", "metrics": {"agent_plan_safety_score": 1.0, "default_cli_seconds": 0.542}, "objective": "Improve RPA Harness reliability with measured, reversible changes.", "run": 8, "status": "keep", "timestamp": "2026-04-29T07:52:52.001375+00:00", "type": "run"}
{"benchmark": {"command": "bash .autoresearch/autoresearch.sh", "duration_seconds": 0.604, "exit_code": 0, "tail_output": "METRIC artifact_hygiene_score=16\nMETRIC default_cli_seconds=0.565\n", "timed_out": false}, "checks": {"command": "bash .autoresearch/autoresearch.checks.sh", "duration_seconds": 0.557, "exit_code": 0, "tail_output": "..............................................                           [100%]\n46 passed in 0.32s\n", "timed_out": false}, "confidence": null, "direction": "higher", "heartbeat": [{"detail": "", "name": "session_files", "status": "ok"}, {"detail": "", "name": "memory", "status": "ok"}, {"detail": "8/25", "name": "budget", "status": "ok"}, {"detail": "", "name": "git_scope", "status": "ok"}, {"detail": "", "name": "secret_scan", "status": "ok"}], "lesson": "Accepted measured result for artifact_hygiene_score: 16.0", "metric": 16.0, "metric_name": "artifact_hygiene_score", "metrics": {"artifact_hygiene_score": 16.0, "default_cli_seconds": 0.565}, "objective": "Improve RPA Harness reliability with measured, reversible changes.", "run": 9, "status": "keep", "timestamp": "2026-04-29T07:54:16.797127+00:00", "type": "run"}
{"benchmark": {"command": "bash .autoresearch/autoresearch.sh", "duration_seconds": 0.65, "exit_code": 0, "tail_output": "METRIC artifact_hygiene_score=17\nMETRIC default_cli_seconds=0.611\n", "timed_out": false}, "checks": {"command": "bash .autoresearch/autoresearch.checks.sh", "duration_seconds": 0.552, "exit_code": 0, "tail_output": "..............................................                           [100%]\n46 passed in 0.31s\n", "timed_out": false}, "confidence": null, "direction": "higher", "heartbeat": [{"detail": "", "name": "session_files", "status": "ok"}, {"detail": "", "name": "memory", "status": "ok"}, {"detail": "9/25", "name": "budget", "status": "ok"}, {"detail": "", "name": "git_scope", "status": "ok"}, {"detail": "", "name": "secret_scan", "status": "ok"}], "lesson": "Accepted measured result for artifact_hygiene_score: 17.0", "metric": 17.0, "metric_name": "artifact_hygiene_score", "metrics": {"artifact_hygiene_score": 17.0, "default_cli_seconds": 0.611}, "objective": "Improve RPA Harness reliability with measured, reversible changes.", "run": 10, "status": "keep", "timestamp": "2026-04-29T08:58:25.357715+00:00", "type": "run"}
{"benchmark": {"command": "bash .autoresearch/autoresearch.sh", "duration_seconds": 0.597, "exit_code": 0, "tail_output": "METRIC artifact_hygiene_score=18\nMETRIC default_cli_seconds=0.565\n", "timed_out": false}, "checks": {"command": "bash .autoresearch/autoresearch.checks.sh", "duration_seconds": 0.516, "exit_code": 0, "tail_output": "..............................................                           [100%]\n46 passed in 0.30s\n", "timed_out": false}, "confidence": 2.0, "direction": "higher", "heartbeat": [{"detail": "", "name": "session_files", "status": "ok"}, {"detail": "", "name": "memory", "status": "ok"}, {"detail": "10/25", "name": "budget", "status": "ok"}, {"detail": "", "name": "git_scope", "status": "ok"}, {"detail": "", "name": "secret_scan", "status": "ok"}], "lesson": "Accepted measured result for artifact_hygiene_score: 18.0", "metric": 18.0, "metric_name": "artifact_hygiene_score", "metrics": {"artifact_hygiene_score": 18.0, "default_cli_seconds": 0.565}, "objective": "Improve RPA Harness reliability with measured, reversible changes.", "run": 11, "status": "keep", "timestamp": "2026-04-29T09:21:47.502072+00:00", "type": "run"}
{"benchmark": {"command": "bash .autoresearch/autoresearch.sh", "duration_seconds": 0.689, "exit_code": 0, "tail_output": "METRIC artifact_hygiene_score=18\nMETRIC default_cli_seconds=0.643\n", "timed_out": false}, "checks": {"command": "bash .autoresearch/autoresearch.checks.sh", "duration_seconds": 0.615, "exit_code": 0, "tail_output": "..............................................                           [100%]\n46 passed in 0.34s\n", "timed_out": false}, "confidence": 4.0, "direction": "higher", "heartbeat": [{"detail": "", "name": "session_files", "status": "ok"}, {"detail": "", "name": "memory", "status": "ok"}, {"detail": "11/25", "name": "budget", "status": "ok"}, {"detail": "Dirty files outside autoresearch scope: harness/selectors/browser_swarm.py, main.py", "name": "git_scope", "status": "warn"}, {"detail": "", "name": "secret_scan", "status": "ok"}], "lesson": "Measured result did not improve the best kept metric.", "metric": 18.0, "metric_name": "artifact_hygiene_score", "metrics": {"artifact_hygiene_score": 18.0, "default_cli_seconds": 0.643}, "objective": "Improve RPA Harness reliability with measured, reversible changes.", "run": 12, "status": "discard", "timestamp": "2026-04-29T11:25:41.559987+00:00", "type": "run"}
{"benchmark": {"command": "bash .autoresearch/autoresearch.sh", "duration_seconds": 0.666, "exit_code": 0, "tail_output": "METRIC artifact_hygiene_score=18\nMETRIC default_cli_seconds=0.624\n", "timed_out": false}, "checks": {"command": "bash .autoresearch/autoresearch.checks.sh", "duration_seconds": 0.605, "exit_code": 0, "tail_output": "..............................................                           [100%]\n46 passed in 0.35s\n", "timed_out": false}, "confidence": null, "direction": "higher", "heartbeat": [{"detail": "", "name": "session_files", "status": "ok"}, {"detail": "", "name": "memory", "status": "ok"}, {"detail": "12/25", "name": "budget", "status": "ok"}, {"detail": "Dirty files outside autoresearch scope: harness/selectors/browser_swarm.py, main.py", "name": "git_scope", "status": "warn"}, {"detail": "", "name": "secret_scan", "status": "ok"}], "lesson": "Measured result did not improve the best kept metric.", "metric": 18.0, "metric_name": "artifact_hygiene_score", "metrics": {"artifact_hygiene_score": 18.0, "default_cli_seconds": 0.624}, "objective": "Improve RPA Harness reliability with measured, reversible changes.", "run": 13, "status": "discard", "timestamp": "2026-04-29T11:32:29.579429+00:00", "type": "run"}
{"benchmark": {"command": "bash .autoresearch/autoresearch.sh", "duration_seconds": 0.688, "exit_code": 0, "tail_output": "METRIC artifact_hygiene_score=18\nMETRIC default_cli_seconds=0.649\n", "timed_out": false}, "checks": {"command": "bash .autoresearch/autoresearch.checks.sh", "duration_seconds": 0.585, "exit_code": 0, "tail_output": "..............................................                           [100%]\n46 passed in 0.33s\n", "timed_out": false}, "confidence": null, "direction": "higher", "heartbeat": [{"detail": "", "name": "session_files", "status": "ok"}, {"detail": "", "name": "memory", "status": "ok"}, {"detail": "13/25", "name": "budget", "status": "ok"}, {"detail": "Dirty files outside autoresearch scope: harness/selectors/browser_swarm.py, main.py", "name": "git_scope", "status": "warn"}, {"detail": "", "name": "secret_scan", "status": "ok"}], "lesson": "Measured result did not improve the best kept metric.", "metric": 18.0, "metric_name": "artifact_hygiene_score", "metrics": {"artifact_hygiene_score": 18.0, "default_cli_seconds": 0.649}, "objective": "Improve RPA Harness reliability with measured, reversible changes.", "run": 14, "status": "discard", "timestamp": "2026-04-29T11:58:55.001750+00:00", "type": "run"}
{"benchmark": {"command": "bash .autoresearch/autoresearch.sh", "duration_seconds": 0.67, "exit_code": 0, "tail_output": "METRIC artifact_hygiene_score=18\nMETRIC default_cli_seconds=0.631\n", "timed_out": false}, "checks": {"command": "bash .autoresearch/autoresearch.checks.sh", "duration_seconds": 0.582, "exit_code": 0, "tail_output": "..............................................                           [100%]\n46 passed in 0.33s\n", "timed_out": false}, "confidence": null, "direction": "higher", "heartbeat": [{"detail": "", "name": "session_files", "status": "ok"}, {"detail": "", "name": "memory", "status": "ok"}, {"detail": "14/25", "name": "budget", "status": "ok"}, {"detail": "Dirty files outside autoresearch scope: harness/selectors/browser_swarm.py, main.py", "name": "git_scope", "status": "warn"}, {"detail": "", "name": "secret_scan", "status": "ok"}], "lesson": "Measured result did not improve the best kept metric.", "metric": 18.0, "metric_name": "artifact_hygiene_score", "metrics": {"artifact_hygiene_score": 18.0, "default_cli_seconds": 0.631}, "objective": "Improve RPA Harness reliability with measured, reversible changes.", "run": 15, "status": "discard", "timestamp": "2026-04-29T12:01:16.191781+00:00", "type": "run"}
{"benchmark": {"command": "bash .autoresearch/autoresearch.sh", "duration_seconds": 0.664, "exit_code": 0, "tail_output": "METRIC artifact_hygiene_score=18\nMETRIC default_cli_seconds=0.626\n", "timed_out": false}, "checks": {"command": "bash .autoresearch/autoresearch.checks.sh", "duration_seconds": 0.562, "exit_code": 0, "tail_output": "..............................................                           [100%]\n46 passed in 0.32s\n", "timed_out": false}, "confidence": null, "direction": "higher", "heartbeat": [{"detail": "", "name": "session_files", "status": "ok"}, {"detail": "", "name": "memory", "status": "ok"}, {"detail": "15/25", "name": "budget", "status": "ok"}, {"detail": "Dirty files outside autoresearch scope: harness/selectors/browser_swarm.py, main.py, .agents/skills/search-to-rpa-workflow/", "name": "git_scope", "status": "warn"}, {"detail": "", "name": "secret_scan", "status": "ok"}], "lesson": "Measured result did not improve the best kept metric.", "metric": 18.0, "metric_name": "artifact_hygiene_score", "metrics": {"artifact_hygiene_score": 18.0, "default_cli_seconds": 0.626}, "objective": "Improve RPA Harness reliability with measured, reversible changes.", "run": 16, "status": "discard", "timestamp": "2026-04-29T12:32:05.953341+00:00", "type": "run"}
{"benchmark": {"command": "bash .autoresearch/autoresearch.sh", "duration_seconds": 0.615, "exit_code": 0, "tail_output": "METRIC artifact_hygiene_score=19\nMETRIC default_cli_seconds=0.583\n", "timed_out": false}, "checks": {"command": "bash .autoresearch/autoresearch.checks.sh", "duration_seconds": 0.513, "exit_code": 0, "tail_output": "..............................................                           [100%]\n46 passed in 0.29s\n", "timed_out": false}, "confidence": null, "direction": "higher", "heartbeat": [{"detail": "", "name": "session_files", "status": "ok"}, {"detail": "", "name": "memory", "status": "ok"}, {"detail": "16/25", "name": "budget", "status": "ok"}, {"detail": "", "name": "git_scope", "status": "ok"}, {"detail": "", "name": "secret_scan", "status": "ok"}], "lesson": "Accepted measured result for artifact_hygiene_score: 19.0", "metric": 19.0, "metric_name": "artifact_hygiene_score", "metrics": {"artifact_hygiene_score": 19.0, "default_cli_seconds": 0.583}, "objective": "Improve RPA Harness reliability with measured, reversible changes.", "run": 17, "status": "keep", "timestamp": "2026-04-30T07:54:28.857862+00:00", "type": "run"}
{"benchmark": {"command": "bash .autoresearch/autoresearch.sh", "duration_seconds": 0.587, "exit_code": 0, "tail_output": "METRIC artifact_hygiene_score=20\nMETRIC default_cli_seconds=0.556\n", "timed_out": false}, "checks": {"command": "bash .autoresearch/autoresearch.checks.sh", "duration_seconds": 0.504, "exit_code": 0, "tail_output": "..............................................                           [100%]\n46 passed in 0.29s\n", "timed_out": false}, "confidence": null, "direction": "higher", "heartbeat": [{"detail": "", "name": "session_files", "status": "ok"}, {"detail": "", "name": "memory", "status": "ok"}, {"detail": "17/25", "name": "budget", "status": "ok"}, {"detail": "", "name": "git_scope", "status": "ok"}, {"detail": "", "name": "secret_scan", "status": "ok"}], "lesson": "Accepted measured result for artifact_hygiene_score: 20.0", "metric": 20.0, "metric_name": "artifact_hygiene_score", "metrics": {"artifact_hygiene_score": 20.0, "default_cli_seconds": 0.556}, "objective": "Improve RPA Harness reliability with measured, reversible changes.", "run": 18, "status": "keep", "timestamp": "2026-04-30T09:25:02.627634+00:00", "type": "run"}
