{"benchmark": {"command": "bash .autoresearch/autoresearch.sh", "duration_seconds": 0.586, "exit_code": 0, "tail_output": "METRIC artifact_hygiene_score=21\nMETRIC default_cli_seconds=0.554\n", "timed_out": false}, "checks": {"command": "bash .autoresearch/autoresearch.checks.sh", "duration_seconds": 0.502, "exit_code": 0, "tail_output": "..............................................                           [100%]\n46 passed in 0.28s\n", "timed_out": false}, "confidence": null, "direction": "higher", "heartbeat": [{"detail": "", "name": "session_files", "status": "ok"}, {"detail": "", "name": "memory", "status": "ok"}, {"detail": "18/25", "name": "budget", "status": "ok"}, {"detail": "", "name": "git_scope", "status": "ok"}, {"detail": "", "name": "secret_scan", "status": "ok"}], "lesson": "Accepted measured result for artifact_hygiene_score: 21.0", "metric": 21.0, "metric_name": "artifact_hygiene_score", "metrics": {"artifact_hygiene_score": 21.0, "default_cli_seconds": 0.554}, "objective": "Improve RPA Harness reliability with measured, reversible changes.", "run": 19, "status": "keep", "timestamp": "2026-04-30T10:44:21.148889+00:00", "type": "run"}
{"benchmark": {"command": "bash .autoresearch/autoresearch.sh", "duration_seconds": 0.598, "exit_code": 0, "tail_output": "METRIC artifact_hygiene_score=22\nMETRIC default_cli_seconds=0.565\n", "timed_out": false}, "checks": {"command": "bash .autoresearch/autoresearch.checks.sh", "duration_seconds": 0.504, "exit_code": 0, "tail_output": "..............................................                           [100%]\n46 passed in 0.28s\n", "timed_out": false}, "confidence": 12.0, "direction": "higher", "heartbeat": [{"detail": "", "name": "session_files", "status": "ok"}, {"detail": "", "name": "memory", "status": "ok"}, {"detail": "19/25", "name": "budget", "status": "ok"}, {"detail": "", "name": "git_scope", "status": "ok"}, {"detail": "", "name": "secret_scan", "status": "ok"}], "lesson": "Accepted measured result for artifact_hygiene_score: 22.0", "metric": 22.0, "metric_name": "artifact_hygiene_score", "metrics": {"artifact_hygiene_score": 22.0, "default_cli_seconds": 0.565}, "objective": "Improve RPA Harness reliability with measured, reversible changes.", "run": 20, "status": "keep", "timestamp": "2026-04-30T12:05:05.994495+00:00", "type": "run"}
{"benchmark": {"command": "bash .autoresearch/autoresearch.sh", "duration_seconds": 0.586, "exit_code": 0, "tail_output": "METRIC artifact_hygiene_score=23\nMETRIC default_cli_seconds=0.554\n", "timed_out": false}, "checks": {"command": "bash .autoresearch/autoresearch.checks.sh", "duration_seconds": 0.541, "exit_code": 0, "tail_output": "..............................................                           [100%]\n46 passed in 0.30s\n", "timed_out": false}, "confidence": 7.0, "direction": "higher", "heartbeat": [{"detail": "", "name": "session_files", "status": "ok"}, {"detail": "", "name": "memory", "status": "ok"}, {"detail": "20/25", "name": "budget", "status": "ok"}, {"detail": "", "name": "git_scope", "status": "ok"}, {"detail": "", "name": "secret_scan", "status": "ok"}], "lesson": "Accepted measured result for artifact_hygiene_score: 23.0", "metric": 23.0, "metric_name": "artifact_hygiene_score", "metrics": {"artifact_hygiene_score": 23.0, "default_cli_seconds": 0.554}, "objective": "Improve RPA Harness reliability with measured, reversible changes.", "run": 21, "status": "keep", "timestamp": "2026-04-30T13:07:42.709204+00:00", "type": "run"}
{"benchmark": {"command": "bash .autoresearch/autoresearch.sh", "duration_seconds": 0.595, "exit_code": 0, "tail_output": "METRIC artifact_hygiene_score=24\nMETRIC default_cli_seconds=0.564\n", "timed_out": false}, "checks": {"command": "bash .autoresearch/autoresearch.checks.sh", "duration_seconds": 0.501, "exit_code": 0, "tail_output": "..............................................                           [100%]\n46 passed in 0.28s\n", "timed_out": false}, "confidence": 8.0, "direction": "higher", "heartbeat": [{"detail": "", "name": "session_files", "status": "ok"}, {"detail": "", "name": "memory", "status": "ok"}, {"detail": "21/25", "name": "budget", "status": "ok"}, {"detail": "", "name": "git_scope", "status": "ok"}, {"detail": "", "name": "secret_scan", "status": "ok"}], "lesson": "Accepted measured result for artifact_hygiene_score: 24.0", "metric": 24.0, "metric_name": "artifact_hygiene_score", "metrics": {"artifact_hygiene_score": 24.0, "default_cli_seconds": 0.564}, "objective": "Improve RPA Harness reliability with measured, reversible changes.", "run": 22, "status": "keep", "timestamp": "2026-04-30T14:38:55.717471+00:00", "type": "run"}
{"benchmark": {"command": "bash .autoresearch/autoresearch.sh", "duration_seconds": 0.638, "exit_code": 0, "tail_output": "METRIC artifact_hygiene_score=25\nMETRIC default_cli_seconds=0.599\n", "timed_out": false}, "checks": {"command": "bash .autoresearch/autoresearch.checks.sh", "duration_seconds": 0.646, "exit_code": 0, "tail_output": "..............................................                           [100%]\n46 passed in 0.30s\n", "timed_out": false}, "confidence": 9.0, "direction": "higher", "heartbeat": [{"detail": "", "name": "session_files", "status": "ok"}, {"detail": "", "name": "memory", "status": "ok"}, {"detail": "22/25", "name": "budget", "status": "ok"}, {"detail": "", "name": "git_scope", "status": "ok"}, {"detail": "", "name": "secret_scan", "status": "ok"}], "lesson": "Accepted measured result for artifact_hygiene_score: 25.0", "metric": 25.0, "metric_name": "artifact_hygiene_score", "metrics": {"artifact_hygiene_score": 25.0, "default_cli_seconds": 0.599}, "objective": "Improve RPA Harness reliability with measured, reversible changes.", "run": 23, "status": "keep", "timestamp": "2026-04-30T18:33:06.387533+00:00", "type": "run"}
{"benchmark": {"command": "bash .autoresearch/autoresearch.sh", "duration_seconds": 0.615, "exit_code": 0, "tail_output": "METRIC artifact_hygiene_score=26\nMETRIC default_cli_seconds=0.580\n", "timed_out": false}, "checks": {"command": "bash .autoresearch/autoresearch.checks.sh", "duration_seconds": 0.523, "exit_code": 0, "tail_output": "..............................................                           [100%]\n46 passed in 0.30s\n", "timed_out": false}, "confidence": 6.667, "direction": "higher", "heartbeat": [{"detail": "", "name": "session_files", "status": "ok"}, {"detail": "", "name": "memory", "status": "ok"}, {"detail": "23/25", "name": "budget", "status": "ok"}, {"detail": "", "name": "git_scope", "status": "ok"}, {"detail": "", "name": "secret_scan", "status": "ok"}], "lesson": "Accepted measured result for artifact_hygiene_score: 26.0", "metric": 26.0, "metric_name": "artifact_hygiene_score", "metrics": {"artifact_hygiene_score": 26.0, "default_cli_seconds": 0.58}, "objective": "Improve RPA Harness reliability with measured, reversible changes.", "run": 24, "status": "keep", "timestamp": "2026-04-30T19:42:24.783262+00:00", "type": "run"}
{"benchmark": {"command": "bash .autoresearch/autoresearch.sh", "duration_seconds": 0.636, "exit_code": 0, "tail_output": "METRIC artifact_hygiene_score=27\nMETRIC default_cli_seconds=0.599\n", "timed_out": false}, "checks": {"command": "bash .autoresearch/autoresearch.checks.sh", "duration_seconds": 0.588, "exit_code": 0, "tail_output": "..............................................                           [100%]\n46 passed in 0.33s\n", "timed_out": false}, "confidence": 5.5, "direction": "higher", "heartbeat": [{"detail": "", "name": "session_files", "status": "ok"}, {"detail": "", "name": "memory", "status": "ok"}, {"detail": "24/25", "name": "budget", "status": "ok"}, {"detail": "", "name": "git_scope", "status": "ok"}, {"detail": "", "name": "secret_scan", "status": "ok"}], "lesson": "Accepted measured result for artifact_hygiene_score: 27.0", "metric": 27.0, "metric_name": "artifact_hygiene_score", "metrics": {"artifact_hygiene_score": 27.0, "default_cli_seconds": 0.599}, "objective": "Improve RPA Harness reliability with measured, reversible changes.", "run": 25, "status": "keep", "timestamp": "2026-05-01T10:15:52.542494+00:00", "type": "run"}
